{
  "id": "det-test-001",
  "rule_id": "rule-waf-block-burst",
  "rule_name": "WAF block burst",
  "telemetry_event_ids": ["evt-test-001"],
  "detected_at": "2026-09-12T09:01:00Z",
  "severity": "SEVERITY_HIGH",
  "confidence": 0.9,
  "title": "Synthetic burst of WAF blocks",
  "description": "synthetic contract test data — not a real security finding",
  "attributes": {"window": "60s", "count": "12"}
}
